{
  "count": 10,
  "first": "xx",
  "last": "",
  "prev": "",
  "next": "",
  "items": [
    {
      "id": "xxx",
      "name": "",
      "description": "",
      "status": "PUBLISHED",
      "startDate": 789798787,
      "endDate": 7978768,
      "links": {
          "self": "programs/1"
      }
    }
  ]
}