{
  "count": 10,
  "prev": "xx",
  "next": "xxx",
  "first": "xxx",
  "last": "xxx",
  "items": [
    {
      "inviter": {
        "username": "pzzheng",
        "nickname": "peizhen zheng",
        "id": "1",
        "email": "pzzheng@thoughtworks.com",
        "role": "Dev",
        "department": "Professional Services"
      },
      "author": {
        "username": "pzzheng",
        "nickname": "peizhen zheng",
        "id": "1",
        "email": "pzzheng@thoughtworks.com",
        "role": "Dev",
        "department": "Professional Services"
      },
      "id": "invitation id",
      "author_role": "COACH | OBSERVER",
      "program": {
        "id": "xxx",
        "name": "xxx"
      },
      "evidence": {
        "id": "xxx",
        "content": "his evidence",
        "createdAt": 1476347270
      },
      "behavior": {
        "id": "xxx",
        "name": "name",
        "description": "xxx",
        "hint": "xxx",
        "competence": {
          "id": "xxx",
          "name": "self confidence",
          "description": "a...",
          "category": {
            "id": "xxx",
            "name": "core competence"
          },
          "links": {
            "self": "competences/1"
          }
        }
      },
      "links": [
        {
          "rel": "self",
          "uri": "/users/uxxx/self_reflections/xxx/evidences/xxx/feedbacks"
        },
        {
          "rel": "evidence",
          "uri": "/users/uxxx/self_reflections/xxx/evidences/xxx"
        }
      ]
    }
  ]
}
